,title,com_score,link,play,count,sub_subject,label,main_subject
0,徐老师来巡山83：大龙神秘被抢 凶手竟然是？！,476862,http://www.bilibili.com/video/av6388107,650804,7036,网游・电竞,LOL 搞笑 徐老师 巡山 逗比 英雄联盟 徐老师来巡山 游戏集锦 B站看不见脸的男人 ,游戏
1,【C菌】最辣鸡恐怖游戏!! 那些最恐怖的游戏集合【第33期】,433848,http://www.bilibili.com/video/av6393106,352416,25670,单机联机,B站三怂 恐怖游戏集合 渗透之C君 结尾彩蛋 把自己鬼畜了 c菌的量词有毒 c菌叫声吓死人系列 游戏没UP吓人系列 下楼梯模拟器 噗哈哈哈 日常快进23333 量词破碎 ,游戏
2,【官方回播】《Fate\/Grand Order》公测发布会,361358,http://www.bilibili.com/video/av6385671,222853,5948,网游・电竞,陈坤 我坤盛世美颜 ios版本9月29日 公测发布会 命运-冠位指定 Fate/GO Fate/Grand Order fgo ,游戏
3,【敖厂长】抽风扯蛋游戏,356631,http://www.bilibili.com/video/av6384185,694881,8271,单机联机,防不胜防 安卓 敖厂长 手机游戏 吐槽 敖敖的零 感觉防不胜防 僵尸漫步 优酷 ,游戏
4,【主播真会玩】57：老冰鸟冻结“卢本伟”强行改名！,318114,http://www.bilibili.com/video/av6378813,739795,5044,网游・电竞,主播真会玩 起小点 搞笑 集锦 卢本屎 起小点永不为奴 长歌是大腿 是大腿 相声二人组 ,游戏
5,【老E】所以说恐怖游戏什么的最讨厌了(?д?;),298580,http://www.bilibili.com/video/av6380138,524371,7475,单机联机,老E 老板最可耐了 李这样会失去我的 李爸爸保护协会 b站3怂 是新的玩法吗？ 老鹅宝宝 恐惧地狱 冰淇淋人 ,游戏
6,【那些游戏里的人#13】现代战争――幽灵,282796,http://www.bilibili.com/video/av6391189,177147,1383,单机联机,现代战争 使命召唤 满分作文系列 幽灵 ,游戏
7,守望先锋【午时已到】第12期：瑟瑟发抖的LAOX,261019,http://www.bilibili.com/video/av6406308,0,1851,网游・电竞,炮炮 逗鱼时刻 守望先锋 游戏集锦 精彩集锦 天天卡牌 LaoX pig 午时已到 老李 ,游戏
8,【小绝】冻住，不洗澡！发挥还不错的两局小美  守望先锋,223817,http://www.bilibili.com/video/av6386740,267051,1980,网游・电竞,守望先锋 小绝 yaoyao 他们用的是yy pigff 麦克美 老孟 小伟 老李 NT ,游戏
9,【史丹利快报第三季】05团长我无需求，先下线了,218490,http://www.bilibili.com/video/av6376730,496704,6614,网游・电竞,史丹利快报 屎蛋 原创 暴白集体现身 幼年温斯顿 最后一期系列 破节目吃枣药丸 每周四更新 ,游戏
10,主播炸了120：PDD骚话连篇还是翻车 国服第一哥弟内讧,210500,http://www.bilibili.com/video/av6395319,258018,1388,网游・电竞,英雄联盟 主播炸了 聚印象 高产如母猪 无敌高产のUP ,游戏
11,【守望先锋】神级cos,191231,http://www.bilibili.com/video/av6355655,0,0,,,游戏
12,起小点TOP10 VOL234 敏锐疾行！战争女神的极限狩猎,181829,http://www.bilibili.com/video/av6405736,223346,1179,网游・电竞,英雄联盟 英雄时刻 精彩集锦 我上我也行 起小点永不为奴 长歌是大腿 你就 TOP10 嘴强王者 ,游戏
13,努巴尼欢乐秀35：为什么麦克雷如此孤单？,172845,http://www.bilibili.com/video/av6393568,0,1095,网游・电竞,守望先锋 暴雪游戏 overwatch 努巴尼欢乐秀 努巴尼守望先锋 ,游戏
14,【抗韩中年人】90期.史上最强套路，打到对面删号！,170500,http://www.bilibili.com/video/av6368844,397360,4311,网游・电竞,抗韩中年人 笑笑 七号 英雄联盟 猫片 本尊来袭 欢迎七叔 恭喜秃秃订婚 素质最高上一期 最污中年人 塞恩 复仇之矛 ,游戏
15,【右小死】幕外战争第二季：消失的尊严,169145,http://www.bilibili.com/video/av6379493,184107,3717,网游・电竞,独立游戏 消失 制作人 幕外战争 右小死 韭菜论 幕外战争2 玩家权益 暗改 看前先投币系列 尊严 诈尸 ,游戏
16,【暴走玩啥游戏第二季】03热血传奇 姑娘请留步，我们好像见过,163440,http://www.bilibili.com/video/av6395890,0,2236,网游・电竞,暴走出品 暴走漫画 原创 暴走玩啥游戏第二季 暴走黑啥游戏 ,游戏
17,【六道直播】校园暴力题材！不合群的少女,161046,http://www.bilibili.com/video/av6373908,0,0,单机联机,教育向 解说 失踪人口の回归 土豆六道 橙光游戏 存档狂魔 蜜汁广播腔 不合群的少女 直播录屏 校园暴力 高产帝 ,游戏
18,【FA主播粗事了】56_笑笑骚气宅舞助兴“下鸡无敌术”！,150281,http://www.bilibili.com/video/av6388096,199203,1804,网游・电竞,FA主播粗事了 英雄联盟 坑爹 搞笑 游戏集锦 笑笑 逗比 董弱鸡 PDD fallenangel ,游戏
19,Bloodshot丨这些影子人怎么没完没了了！,137146,http://www.bilibili.com/video/av6399322,132499,3612,单机联机,恐怖游戏 中国BOY 高产似母那啥 每日一嗝 ,游戏
20,王老菊带你永恒空间,133345,http://www.bilibili.com/video/av6374713,0,6458,单机联机,王老菊 老坑未完新坑又开 太阳警察局完结了 太阳空间帝国 警察局亡了 癌细胞羞愧低头 迷之更新 太空菊 ,游戏
21,【骚男合集9.24】门牙没了对面一塔未破也能翻盘+克隆大作战布隆五杀,130682,http://www.bilibili.com/video/av6401065,164740,6117,网游・电竞,弟弟救我 主播真会玩 第一视角 男刀 国服第一 骚男 英雄联盟 刀锋 史诗翻盘 ,游戏
22,当Dva炸掉1000个狂鼠夹子,123365,http://www.bilibili.com/video/av6362520,153883,248,网游・电竞,D.VA 守望先锋 狂鼠 ,游戏
23,【某幻】杀死十二个混蛋,120943,http://www.bilibili.com/video/av6385081,117735,1920,单机联机,迷之感动 灵魂画师 某幻君 克苏鲁 迷之高产 灵魂画手 数学老师：喵喵喵？！ 数学老师到底什么梗 爷爷的关注列表 最强起名王 暗黑地牢 ,游戏
24,陆夫人带你遛――TGS2016,106748,http://www.bilibili.com/video/av6410724,82057,3984,单机联机,神奇陆夫人 独立游戏 东京电玩展 神奇陆后期 TGS2016 孤独的陆夫人 ,游戏
25,恐怖&吐槽！鬼宅作大死！用手电筒单刷超自然庄园【诅咒Curse】P1,90773,http://www.bilibili.com/video/av6400378,66849,2812,单机联机,穿胖次的狐狸 恐怖游戏 搞笑 吐槽 是谁，在敲打我窗 ,游戏
26,起小D守望Top10 VOL18：重力喷涌的另类奥义-地爆天星！,89899,http://www.bilibili.com/video/av6402177,103179,755,网游・电竞,守望先锋 解说 集锦 起小D是大腿 TOP10 ,游戏
27,【散人】黑暗关终极合作 蠢绿傻紫最后的冒险,89087,http://www.bilibili.com/video/av6381579,0,4296,单机联机,精分现场 友尽 逍遥散人 散人 卢散 黑暗双人关 散卢 kalimba 友尽的游戏 友尽游戏 ,游戏
28,【Dota中文字幕】冰蛙(Icefrog)的个人历史 [Pendragon事件第二部],88846,http://www.bilibili.com/video/av6378219,79194,900,网游・电竞,LOL Pendragon事件 av6288114 Dota Alls Pendragon Icefrog JinZo Riot Dota Dota2 +1s 冰蛙 ,游戏
29,超级马里奥windowsXP版丨抽风试玩,87625,http://www.bilibili.com/video/av6389217,91139,723,单机联机,抽风解说 抽风 实况解说 超级马里奥 独眼先辈 ,游戏
30,以撒睡前故事一则――打倒坏蛋绝招的是pi冲击,87226,http://www.bilibili.com/video/av6406265,87450,2282,单机联机,失踪人口回归系列 以撒 以撒的结合 封面的夫人不见了！233 以撒新玩法 萌神pi~ 我不会再大喊大叫了 少年Pi 萌神PI ,游戏
31,守望先锋懵逼时刻第十五期：路霸与天使相亲相爱之后居然相杀！,87182,http://www.bilibili.com/video/av6378777,86163,1320,网游・电竞,守望先锋 趣味视频 结尾高能 懵逼时刻q 不给封面就举报 守望屁股 辣眼睛 ,游戏
32,袖剑之下众生平等――刺客信条CG混剪,80484,http://www.bilibili.com/video/av6382550,0,650,GMV,AMV 多素材 单机游戏 全程高能 刺客信条 原创 混剪 Centuries 要啥没啥爱咋咋地 机智的废柴君 刺客信条GMV 混剪处女作 ,游戏
33,崩坏学园3rd调戏琪亚娜被踢下线,79948,http://www.bilibili.com/video/av6342031,81937,328,网游・电竞,崩坏学园3RD ,游戏
34,【尚在天国EX】TGS东京游戏展2016展后试玩报告Part.1【参展厂商篇】,77891,http://www.bilibili.com/video/av6404807,40341,735,单机联机,东京游戏展 SE TGS 最终幻想 konami 卡普空 ,游戏
35,【某阳】守望学院之76篇，核心思路教学,76163,http://www.bilibili.com/video/av6402712,60015,1146,网游・电竞,守望先锋 overwatch 某阳 守望先锋学院 ,游戏
36,某主播第一次玩恐怖游戏，吓到失禁，娇喘福利？？脑都在颤抖！~,67052,http://www.bilibili.com/video/av6120088,88406,1408,单机联机,B站第4怂 TIMORE NOX ,游戏
37,吊带黑丝【PV】Hand in Hand【初音ミク 甜美恶魔】,64964,http://www.bilibili.com/video/av6400576,20536,180,音游,初音社 黑丝吊带 歌姬计划 初音ミク ,游戏
38,新英雄“森林之友-艾翁”打野实战，很变态 -英雄联盟（2）,64581,http://www.bilibili.com/video/av6365742,85693,1753,网游・电竞,英雄联盟 森林之友-艾翁 新英雄 ,游戏
39,岛国终于开始使用VR来制作羞羞dai~游戏了,64532,http://www.bilibili.com/video/av6348742,61443,348,单机联机,PS4 VR 日本 预告 游戏脚本 羞羞 岛国 ,游戏
40,[守望先锋]心跳先锋物语―初入花村(逗川),62945,http://www.bilibili.com/video/av6425802,58980,1353,网游・电竞,灵魂CV 守望先锋 逗川我就服你 恋爱先锋 关爱空巢逗川 B站薛之谦 UP主真是个人才 逗川 UP主是个人才 这破站我就服你 这破站就我服你 ,游戏
41,【视角姬】VR当厨师，轿液诎盗侠砝玻,62446,http://www.bilibili.com/video/av6384805,84606,2089,单机联机,VR游戏 VR Job Simulator 四脚鸡 HTCVIVE 不误正业系列 ,游戏
42,主播炸了119：德云色萌萌套路送货上门 求婚过后现场激情,61194,http://www.bilibili.com/video/av6387783,73299,559,网游・电竞,逗比主播 英雄联盟 LOL ,游戏
43,笑笑西卡德云色 16.9.23 学识丰富的主播,60587,http://www.bilibili.com/video/av6390846,64581,2354,网游・电竞,LOL 西卡 笑笑 直播 英雄联盟 德云色 游戏直播 ,游戏
44,【黑桐丧尸的谷歌围城】视频攻略 03,58048,http://www.bilibili.com/video/av6380834,107836,2982,单机联机,PS4 黑桐谷歌 良心字幕 丧尸围城 割草围城 享受健康生活 杀丧尸哪有救人好玩 无双围城 下饭围城 割草无双 日番谷歌 ,游戏
45,你玩过手机版的守望先锋吗？,57175,http://www.bilibili.com/video/av6370833,65041,1042,网游・电竞,守望先锋 OVERWATCH 守望先锋 手游 手机版守望先锋 狄克 守望先锋搞笑视频 守望先锋集锦 守望先锋视频 手机版 ,游戏
46,不要！去了去了！这支守望先锋MV快燃爆了！,57077,http://www.bilibili.com/video/av6322588,128194,757,GMV,超时空要塞 网络游戏 守望先锋 混剪 GMV 燃向 封面党の胜利 超燃 ,游戏
47,狼人沃S克未淼闹刈鲈O - LoL英雄盟,52614,http://www.bilibili.com/video/av6353200,102873,497,网游・电竞,英雄联盟 LOL ,游戏
48,[新游视玩]要跟守望屁股杠上的《枪火游侠》,51706,http://www.bilibili.com/video/av6373755,67016,875,网游・电竞,腾讯 测评 评测 试玩 企鹅 守望先锋 游戏 枪火游侠 新游视玩 新游戏 ,游戏
49,Steam国区总销量最高的十款游戏【SteamTop10】,50020,http://www.bilibili.com/video/av6397071,75600,2130,单机联机,黎明杀机 CSGO GMOD L4D2 文明5 GTA5 泰拉瑞亚 收获日2 饥荒 饥荒合作版 ,游戏
50,【山下医院2】Q君回来了！当然要玩恐怖游戏！山下医院续作《山下医院2》，还是原来的配方，还是熟悉的味道。,49995,http://www.bilibili.com/video/av6370115,184913,5964,单机联机,三河宏辅 山下智博 耻辱 Q君 恐怖游戏 Q君PLAY STATION 亮点是山下的旁白 35分43秒的人生 游戏区的耻辱233 ,游戏
51,【烈日车队第11期】多拉多隐藏剧情 新英雄sombra线索 地图彩蛋 守望先锋背景故事系列,49505,http://www.bilibili.com/video/av6359999,0,730,网游・电竞,守望先锋动画 守望先锋 守望先锋新英雄 守望先锋剧 多拉多隐藏剧情 烈日车队 守望先锋CG 士兵76 守望先锋视频 狂鼠 ,游戏
52,死或生5：乳峰边缘 【爆衣】不知火舞兔女郎VS坂崎由莉绫音,49331,http://www.bilibili.com/video/av6348617,0,193,单机联机,PS4 爆衣 不知火舞 死或生 绫音 ,游戏
53,【谜之声实况】猎狼谷的小红帽 The Huntress of the Hollow,48674,http://www.bilibili.com/video/av6394904,35775,2893,单机联机,独立游戏 谜之声 小红帽 实况 直播录像 RPGMaker 大灰狼 迷之文艺 少女粉 良心翻译 谜之带感 ,游戏
54,【panda kill】第一季 第二期，王的民装,48361,http://www.bilibili.com/video/av6405972,52064,3644,网游・电竞,狼人杀 pandakill superliar 熊猫TV 熊猫杀 ,游戏
55,PDD16.9.24直播：与五五开约♂战,48348,http://www.bilibili.com/video/av6405740,53144,1838,网游・电竞,PDD 直播 英雄联盟 LOL 骚猪 颜值担当 象拔蚌 游戏直播 ,游戏
56,【夏一可】《守望先锋》：夏家三千菜第七期,47714,http://www.bilibili.com/video/av6352711,317101,1316,网游・电竞,守望先锋 夏一可 OP@凹凸君 夏家三千菜 夏韭菜 夏一鸽 精分女王 ,游戏
57,[老E 录播] 9.21下午 渡劫！五百强！,47398,http://www.bilibili.com/video/av6386112,56171,3656,网游・电竞,录播 老E ,游戏
58,【芝麻】拯救咸鱼大行动！（Depth吓不尿向实况）,46522,http://www.bilibili.com/video/av6392207,34959,965,单机联机,原创 ,游戏
59,【花少北X大忽悠】壁咚和互砍是怎么回事？说好的做彼此的天使呢？,46031,http://www.bilibili.com/video/av6364827,80812,2940,单机联机,黎明杀机 吴织亚切大忽悠 花少北 花老师 大忽悠 实况解说 冷冷的狗粮在往嘴里胡乱的塞 ,游戏
60,【星际老男孩】9月25日第2届CrossFinal（必看）,45919,http://www.bilibili.com/video/av6420244,48007,3602,网游・电竞,狗哥 星际争霸2 星际老男孩 F91 SCBOY 小色 智商杯 世界第一zvt sos tossboy SSL 功夫杯 ,游戏
61,源氏台词第一次听到过 请从60秒后观看,43257,http://www.bilibili.com/video/av6376478,48236,77,网游・电竞,守望先锋 源氏 ,游戏
62,【奇妙的基三】仙贝和总裁不得不说的故♂事,42601,http://www.bilibili.com/video/av6427331,49883,1064,网游・电竞,沐帮主 奇妙的基三 剑网三 剑网3 ,游戏
63,6666Q的无限火力狗头,41644,http://www.bilibili.com/video/av6377825,49055,293,网游・电竞,lol ,游戏
64,每日撸报9.24:上单霸主pdd：断剑重铸之日，骑士归来之时,39693,http://www.bilibili.com/video/av6399007,44849,620,网游・电竞,搞笑集锦 英雄联盟 pdd lol 主播搞笑 主播每日撸报 每日撸报 ,游戏
65,APAC小组赛第二周9月22日A组：IG.FIRE \/ IG.ICE \/ 1246 \/ SNAKE《守望先锋》,39522,http://www.bilibili.com/video/av6374240,76181,4632,网游・电竞,守望先锋 小绝 泛亚太超级锦标赛 APAC 香蕉计划 熊猫TV ,游戏
66,【PandaKill熊猫杀】第一季（第二期）狼人杀法则：干JY,38458,http://www.bilibili.com/video/av6404871,42315,2734,网游・电竞,囚徒 狼人杀 酒神 JY 少帮主 sol王 SuperLiar PandaKill 鼠大鱼 桃子 风行云 ,游戏
67,炉石传说 - 欢乐幸运时刻：第185集,37771,http://www.bilibili.com/video/av6420236,0,192,网游・电竞,网络游戏 炉石 卡牌对战 炉石传说 游戏集锦 欢乐幸运时刻 奶茶没有性生活 卡牌 ,游戏
68,【大宝剑联盟】生化危机7官方先行预告片,37721,http://www.bilibili.com/video/av6353148,95177,333,单机联机,大宝剑联盟 生化危机 youtube 类似寂静岭的生化危机 ,游戏
69,非酋阴阳师50抽实况,37600,http://www.bilibili.com/video/av6329489,88682,3197,网游・电竞,非洲人の怨念 珠峰实况 珠峰喵 阴阳师 阴阳师手游 ,游戏
70,【IGICE小绝MVP】APAC小绝首次全场最佳柴犬砍四人,37224,http://www.bilibili.com/video/av6389100,0,188,网游・电竞,守望先锋 小绝 APAC IGICE 全场最佳 ,游戏
71,当 森林之友 - 艾翁 变成金属大师的幽灵的时候 lol英雄联盟,36880,http://www.bilibili.com/video/av6369642,77263,99,网游・电竞,游戏集锦 英雄联盟 LOL ,游戏
72,守望先锋【SC天天守望16】叉宝宝表情包   朱菲菲尾行猪,36777,http://www.bilibili.com/video/av6388835,40741,558,网游・电竞,守望先锋 孔连顺 夏一可 拉面 laox jamlee ShowCen pigff SC天天守望 小伟 ,游戏
73,【守望先锋】性别转换！这个小美真的GAY呀！撩到你了吗.....,36472,http://www.bilibili.com/video/av6352684,31518,541,网游・电竞,守望先锋 性别转换 ,游戏
74,守望先锋堡垒的大炮 真的藏在四次元菊花里吗？,35736,http://www.bilibili.com/video/av6355413,59462,312,网游・电竞,守望先锋 坦克 堡垒说的对 污里贱贱荐 堡垒 ,游戏
75,萤草座敷互怼到天明,35542,http://www.bilibili.com/video/av6377534,42769,793,网游・电竞,结界突破 座敷童子戴涅御魂 萤草 阴阳师手游 ,游戏
76,DOTA2 YYF小剧场 Ep.7 枫驰天下！,35297,http://www.bilibili.com/video/av6422024,45771,588,网游・电竞,DOTA 2 YYF 小剧场 ,游戏
77,传颂之物：二人的白皇 第一章③-当时的帝都,34893,http://www.bilibili.com/video/av6398753,0,2036,单机联机,二人的白皇 虚伪的假面 传颂之物 你们要的OP来了 需求OP 越来越短的up主 麻吕吕你肿么了 美希命uS出品 短小快 药 10月新番 ,游戏
78,电竞没有二十投！队友全部挂机卖装备一样翻盘！,34436,http://www.bilibili.com/video/av6357363,195570,3130,网游・电竞,那万一赢了呢？ 英雄联盟 迷之感动 玩LOL没服过人 这小法第一个 稳健兽进化！ 白银皇帝我王的日常 那万一硬了呢？ 中国电竞没有二十投 厉害的UP主 翻盘 封面党 ,游戏
79,新英雄+4款魔法少女皮肤总览 森林之友艾翁 金克斯 露露 波比 迦娜 暴走萝莉 波比,32716,http://www.bilibili.com/video/av6361609,36474,721,网游・电竞,英雄联盟LOL 英雄联盟新皮肤 英雄联盟新英雄 ,游戏
80,简易楼梯隐藏门,32556,http://www.bilibili.com/video/av6339723,16254,46,单机联机,红石 小黑 我的世界 教程 Minecraft redstone 隐藏门 楼梯 ,游戏
81,2016 英雄联盟明星主播对抗赛 第一日,32076,http://www.bilibili.com/video/av6332622,104838,4889,网游・电竞,英雄联盟 明星主播对抗赛 ,游戏
82,【守望动画】守望先锋很有趣,31310,http://www.bilibili.com/video/av6407601,31567,98,网游・电竞,守望先锋 同人 ,游戏
83,国外玩家试玩《枪火游侠》（不要笑场啊魂淡）,31285,http://www.bilibili.com/video/av6332093,47703,246,网游・电竞,守望先锋 枪火游侠 Paladins Overwatch 高端黑 ,游戏
84,新英雄+狮子狗,31055,http://www.bilibili.com/video/av6374736,40087,388,网游・电竞,英雄联盟 LOL ,游戏
85,崩坏3首次十连抽！！！,30239,http://www.bilibili.com/video/av6355958,39006,232,网游・电竞,崩坏3 ,游戏
86,【允星河】爸爸与自行车的故事,30042,http://www.bilibili.com/video/av6343122,0,1243,单机联机,允星河 蜜汁感动 单车 boy不在家系列 越来越短的允大dio 瀚哲 翰哲 爸爸与自行车的故事 之空 ,游戏
87,【闻香识】战地1Beta测试精彩剪辑,29954,http://www.bilibili.com/video/av6381004,0,361,单机联机,战地1 闻香识 ,游戏
88,【双语】2016年10大生存游戏盘点 《饥荒》竟然不是第一  @游民星空字幕组,29948,http://www.bilibili.com/video/av6363682,22570,363,单机联机,游民星空字幕组 饥荒 ,游戏
89,Numen敌我差距：厉害了我的哥！超级兵怒抢五杀！,29317,http://www.bilibili.com/video/av6379483,37833,301,网游・电竞,英雄联盟 Numen Numen敌我差距 敌我差距 ,游戏
90,《合金弹头》全隐藏要素收集速攻合集（1~5代）,28547,http://www.bilibili.com/video/av6337384,18722,1512,单机联机,合金弹头 嗨尼玛性感 强，无敌 越南大战 ,游戏
91,Dota 2 每周失败集锦 Ep. 163,28309,http://www.bilibili.com/video/av6391927,32490,495,网游・电竞,dota2 ,游戏
92,卢西奥细节彩蛋：将游戏音量调至0时，扩音器喇叭将停止震动，音乐波形图不再跳跃,27979,http://www.bilibili.com/video/av6361036,34368,20,网游・电竞,守望先锋 彩蛋 暴雪 DJ 卢西奥 细节 ,游戏
93,LOL你看完这段亚索视频，就会明白为何拳头削弱亚索了,27877,http://www.bilibili.com/video/av6369712,0,218,网游・电竞,亚索 英雄联盟 LOL ,游戏
94,嗨氏王者荣耀：王者局只剩高地极限翻盘,27471,http://www.bilibili.com/video/av6405086,21436,2084,网游・电竞,王者荣耀 嗨氏 手控福利 小鲜肉 手游 搞笑解说 排位 王者局 萌汉子 ,游戏
95,【魔道祖师】天涯明月刀OL 云梦双杰 『剑笔断春秋』,26599,http://www.bilibili.com/video/av6376595,7279,304,GMV,夷陵老祖 江澄 魏无羡 魔道祖师 天涯明月刀OL 40米大刀 云梦双杰 ,游戏
96,《剑网3》新门派霸刀体服首测 实景画面首曝,26099,http://www.bilibili.com/video/av6421930,0,573,网游・电竞,剑网3 刀爹 霸刀 ,游戏
97,【LOL】英雄联盟10大惊天BUG！泉水都炸了你敢信？,25865,http://www.bilibili.com/video/av6370594,25573,460,网游・电竞,英雄联盟 BUG LOL YouTube搬运 ,游戏
98,【守望先锋CG宣传片合集】,25204,http://www.bilibili.com/video/av4873874,1527897,26511,网游・电竞,233 暴雪电影制片厂 双龙 CG 守望先锋 黑猎百合 守望臀部 屁股先锋 新萌UP 国语配音 宣传片 ,游戏
99,【战舰世界】柜喵的德战评测,25141,http://www.bilibili.com/video/av6427810,0,507,网游・电竞,柜娘 战舰世界国服 失踪人口回归 声控游戏 德系战列 ,游戏
